"No.","Time","Source","Destination","Protocol","Length","Info"
"1","0.000000000","10.0.2.15","157.240.0.60","TLSv1.2","118","Application Data"
"2","0.000583308","157.240.0.60","10.0.2.15","TCP","60","443  >  34064 [ACK] Seq=1 Ack=65 Win=65535 Len=0"
"3","0.170069838","157.240.0.60","10.0.2.15","TLSv1.2","112","Application Data"
"4","0.170161801","10.0.2.15","157.240.0.60","TCP","54","34064  >  443 [ACK] Seq=65 Ack=59 Win=65535 Len=0"
"5","2.139184262","10.0.2.15","157.240.0.60","TLSv1.2","157","Application Data"
"6","2.144289452","157.240.0.60","10.0.2.15","TCP","60","443  >  34064 [ACK] Seq=59 Ack=168 Win=65535 Len=0"
"7","2.314501557","157.240.0.60","10.0.2.15","TLSv1.2","144","Application Data"
"8","2.314559897","10.0.2.15","157.240.0.60","TCP","54","34064  >  443 [ACK] Seq=168 Ack=149 Win=65535 Len=0"
"9","3.048819735","157.240.0.60","10.0.2.15","TLSv1.2","131","Application Data"
"10","3.048869288","10.0.2.15","157.240.0.60","TCP","54","34064  >  443 [ACK] Seq=168 Ack=226 Win=65535 Len=0"
"13","10.665587575","157.240.0.60","10.0.2.15","TLSv1.2","131","Application Data"
"14","10.665629143","10.0.2.15","157.240.0.60","TCP","54","34064  >  443 [ACK] Seq=168 Ack=303 Win=65535 Len=0"
"15","14.983027703","157.240.0.60","10.0.2.15","TLSv1.2","317","Application Data"
"16","14.983081174","10.0.2.15","157.240.0.60","TCP","54","34064  >  443 [ACK] Seq=168 Ack=566 Win=65535 Len=0"
"17","15.101650527","10.0.2.15","157.240.0.60","TLSv1.2","145","Application Data"
"18","15.101925865","157.240.0.60","10.0.2.15","TCP","60","443  >  34064 [ACK] Seq=566 Ack=259 Win=65535 Len=0"
"19","15.191167594","10.0.2.15","157.240.0.60","TLSv1.2","157","Application Data"
"20","15.191775118","157.240.0.60","10.0.2.15","TCP","60","443  >  34064 [ACK] Seq=566 Ack=362 Win=65535 Len=0"
"21","15.362191390","157.240.0.60","10.0.2.15","TLSv1.2","144","Application Data"
"22","15.362233159","10.0.2.15","157.240.0.60","TCP","54","34064  >  443 [ACK] Seq=362 Ack=656 Win=65535 Len=0"
"23","24.556071744","157.240.0.60","10.0.2.15","TLSv1.2","131","Application Data"
"24","24.556130836","10.0.2.15","157.240.0.60","TCP","54","34064  >  443 [ACK] Seq=362 Ack=733 Win=65535 Len=0"
"25","28.706129933","157.240.0.60","10.0.2.15","TLSv1.2","131","Application Data"
"26","28.706173766","10.0.2.15","157.240.0.60","TCP","54","34064  >  443 [ACK] Seq=362 Ack=810 Win=65535 Len=0"
"27","29.525310488","157.240.0.60","10.0.2.15","TLSv1.2","365","Application Data"
"28","29.525364339","10.0.2.15","157.240.0.60","TCP","54","34064  >  443 [ACK] Seq=362 Ack=1121 Win=65535 Len=0"
"29","29.634531152","10.0.2.15","157.240.0.60","TLSv1.2","145","Application Data"
"30","29.634975398","157.240.0.60","10.0.2.15","TCP","60","443  >  34064 [ACK] Seq=1121 Ack=453 Win=65535 Len=0"
"31","29.710131178","10.0.2.15","157.240.0.60","TLSv1.2","157","Application Data"
"32","29.711761918","157.240.0.60","10.0.2.15","TCP","60","443  >  34064 [ACK] Seq=1121 Ack=556 Win=65535 Len=0"
"33","29.881292445","157.240.0.60","10.0.2.15","TLSv1.2","144","Application Data"
"34","29.881379840","10.0.2.15","157.240.0.60","TCP","54","34064  >  443 [ACK] Seq=556 Ack=1211 Win=65535 Len=0"
"35","33.593542958","157.240.0.60","10.0.2.15","TLSv1.2","131","Application Data"
"36","33.593606157","10.0.2.15","157.240.0.60","TCP","54","34064  >  443 [ACK] Seq=556 Ack=1288 Win=65535 Len=0"
"37","40.699986262","157.240.0.60","10.0.2.15","TLSv1.2","131","Application Data"
"38","40.700019204","10.0.2.15","157.240.0.60","TCP","54","34064  >  443 [ACK] Seq=556 Ack=1365 Win=65535 Len=0"
"56","44.294850352","157.240.0.60","10.0.2.15","TLSv1.2","784","Application Data"
"57","44.294893433","10.0.2.15","157.240.0.60","TCP","54","34064  >  443 [ACK] Seq=556 Ack=2095 Win=65535 Len=0"
"58","44.457647611","10.0.2.15","157.240.0.60","TLSv1.2","145","Application Data"
"59","44.459468177","157.240.0.60","10.0.2.15","TCP","60","443  >  34064 [ACK] Seq=2095 Ack=647 Win=65535 Len=0"
"60","44.556292501","10.0.2.15","157.240.0.60","TLSv1.2","157","Application Data"
"61","44.556644894","157.240.0.60","10.0.2.15","TCP","60","443  >  34064 [ACK] Seq=2095 Ack=750 Win=65535 Len=0"
"62","44.730556377","157.240.0.60","10.0.2.15","TLSv1.2","144","Application Data"
"63","44.730625167","10.0.2.15","157.240.0.60","TCP","54","34064  >  443 [ACK] Seq=750 Ack=2185 Win=65535 Len=0"
"66","57.309011694","157.240.0.60","10.0.2.15","TLSv1.2","131","Application Data"
"67","57.309099639","10.0.2.15","157.240.0.60","TCP","54","34064  >  443 [ACK] Seq=750 Ack=2262 Win=65535 Len=0"
"68","59.305789071","157.240.0.60","10.0.2.15","TLSv1.2","1280","Application Data"
"69","59.305896153","10.0.2.15","157.240.0.60","TCP","54","34064  >  443 [ACK] Seq=750 Ack=3488 Win=65535 Len=0"
"70","59.462127400","10.0.2.15","157.240.0.60","TLSv1.2","145","Application Data"
"71","59.462377621","157.240.0.60","10.0.2.15","TCP","60","443  >  34064 [ACK] Seq=3488 Ack=841 Win=65535 Len=0"
"76","68.372713950","10.0.2.15","157.240.0.60","TLSv1.2","124","Application Data"
"77","68.373456572","157.240.0.60","10.0.2.15","TCP","60","443  >  34064 [ACK] Seq=3488 Ack=911 Win=65535 Len=0"
"78","68.545737280","157.240.0.60","10.0.2.15","TLSv1.2","126","Application Data"
"79","68.545774240","10.0.2.15","157.240.0.60","TCP","54","34064  >  443 [ACK] Seq=911 Ack=3560 Win=65535 Len=0"
"84","73.377301745","10.0.2.15","157.240.0.60","TLSv1.2","118","Application Data"
"85","73.378213275","157.240.0.60","10.0.2.15","TCP","60","443  >  34064 [ACK] Seq=3560 Ack=975 Win=65535 Len=0"
"86","75.423218139","157.240.0.60","10.0.2.15","TLSv1.2","784","Application Data"
"87","75.423272371","10.0.2.15","157.240.0.60","TCP","54","34064  >  443 [ACK] Seq=975 Ack=4290 Win=65535 Len=0"
"88","75.591281361","10.0.2.15","157.240.0.60","TLSv1.2","145","Application Data"
"89","75.591829032","157.240.0.60","10.0.2.15","TCP","60","443  >  34064 [ACK] Seq=4290 Ack=1066 Win=65535 Len=0"
"90","81.344639690","10.0.2.15","157.240.0.60","TLSv1.2","118","Application Data"
"91","81.345381646","157.240.0.60","10.0.2.15","TCP","60","443  >  34064 [ACK] Seq=4290 Ack=1130 Win=65535 Len=0"
"92","81.475228703","10.0.2.15","157.240.0.60","TLSv1.2","181","Application Data"
"93","81.475713075","157.240.0.60","10.0.2.15","TCP","60","443  >  34064 [ACK] Seq=4290 Ack=1257 Win=65535 Len=0"
"94","81.514496674","157.240.0.60","10.0.2.15","TLSv1.2","112","Application Data"
"95","81.514541498","10.0.2.15","157.240.0.60","TCP","54","34064  >  443 [ACK] Seq=1257 Ack=4348 Win=65535 Len=0"
"96","81.651147698","157.240.0.60","10.0.2.15","TLSv1.2","144","Application Data"
"97","81.651223080","10.0.2.15","157.240.0.60","TCP","54","34064  >  443 [ACK] Seq=1257 Ack=4438 Win=65535 Len=0"
"98","83.734662940","157.240.0.60","10.0.2.15","TLSv1.2","124","Application Data"
"99","83.734727261","10.0.2.15","157.240.0.60","TCP","54","34064  >  443 [ACK] Seq=1257 Ack=4508 Win=65535 Len=0"
"117","89.104348703","157.240.0.60","10.0.2.15","TLSv1.2","131","Application Data"
"118","89.104393307","10.0.2.15","157.240.0.60","TCP","54","34064  >  443 [ACK] Seq=1257 Ack=4585 Win=65535 Len=0"
"119","89.910312815","157.240.0.60","10.0.2.15","TLSv1.2","784","Application Data"
"120","89.910352961","10.0.2.15","157.240.0.60","TCP","54","34064  >  443 [ACK] Seq=1257 Ack=5315 Win=65535 Len=0"
"121","90.112925160","10.0.2.15","157.240.0.60","TLSv1.2","145","Application Data"
"122","90.113588152","157.240.0.60","10.0.2.15","TCP","60","443  >  34064 [ACK] Seq=5315 Ack=1348 Win=65535 Len=0"
"123","90.255022827","10.0.2.15","157.240.0.60","TLSv1.2","157","Application Data"
"124","90.255874308","157.240.0.60","10.0.2.15","TCP","60","443  >  34064 [ACK] Seq=5315 Ack=1451 Win=65535 Len=0"
"125","90.427559314","157.240.0.60","10.0.2.15","TLSv1.2","144","Application Data"
"126","90.427589831","10.0.2.15","157.240.0.60","TCP","54","34064  >  443 [ACK] Seq=1451 Ack=5405 Win=65535 Len=0"
"127","91.058803377","157.240.0.60","10.0.2.15","TLSv1.2","329","Application Data"
"128","91.058864552","10.0.2.15","157.240.0.60","TCP","54","34064  >  443 [ACK] Seq=1451 Ack=5680 Win=65535 Len=0"
"129","91.067955194","10.0.2.15","157.240.0.60","TLSv1.2","126","Application Data"
"130","91.068448262","157.240.0.60","10.0.2.15","TCP","60","443  >  34064 [ACK] Seq=5680 Ack=1523 Win=65535 Len=0"
"142","103.951554461","157.240.0.60","10.0.2.15","TLSv1.2","131","Application Data"
"143","103.994342805","10.0.2.15","157.240.0.60","TCP","54","34064  >  443 [ACK] Seq=1523 Ack=5757 Win=65535 Len=0"
"144","105.408062416","157.240.0.60","10.0.2.15","TLSv1.2","1280","Application Data"
"145","105.408101088","10.0.2.15","157.240.0.60","TCP","54","34064  >  443 [ACK] Seq=1523 Ack=6983 Win=65535 Len=0"
"146","105.551170212","10.0.2.15","157.240.0.60","TLSv1.2","145","Application Data"
"147","105.551974094","157.240.0.60","10.0.2.15","TCP","60","443  >  34064 [ACK] Seq=6983 Ack=1614 Win=65535 Len=0"
"148","105.658612247","10.0.2.15","157.240.0.60","TLSv1.2","157","Application Data"
"149","105.659298367","157.240.0.60","10.0.2.15","TCP","60","443  >  34064 [ACK] Seq=6983 Ack=1717 Win=65535 Len=0"
"150","105.829567779","157.240.0.60","10.0.2.15","TLSv1.2","144","Application Data"
"151","105.829606462","10.0.2.15","157.240.0.60","TCP","54","34064  >  443 [ACK] Seq=1717 Ack=7073 Win=65535 Len=0"
"152","106.377792327","157.240.0.60","10.0.2.15","TLSv1.2","131","Application Data"
"153","106.377844876","10.0.2.15","157.240.0.60","TCP","54","34064  >  443 [ACK] Seq=1717 Ack=7150 Win=65535 Len=0"
"157","109.645949286","157.240.0.60","10.0.2.15","TLSv1.2","131","Application Data"
"158","109.646036069","10.0.2.15","157.240.0.60","TCP","54","34064  >  443 [ACK] Seq=1717 Ack=7227 Win=65535 Len=0"
"162","119.347515354","157.240.0.60","10.0.2.15","TCP","1446","443  >  34064 [PSH, ACK] Seq=7227 Ack=1717 Win=65535 Len=1392 [TCP segment of a reassembled PDU]"
"163","119.347564937","10.0.2.15","157.240.0.60","TCP","54","34064  >  443 [ACK] Seq=1717 Ack=8619 Win=65535 Len=0"
"164","119.355497633","157.240.0.60","10.0.2.15","TLSv1.2","886","Application Data, Application Data"
"165","119.355544301","10.0.2.15","157.240.0.60","TCP","54","34064  >  443 [ACK] Seq=1717 Ack=9451 Win=65535 Len=0"
"166","119.587533711","10.0.2.15","157.240.0.60","TLSv1.2","145","Application Data"
"167","119.587818427","157.240.0.60","10.0.2.15","TCP","60","443  >  34064 [ACK] Seq=9451 Ack=1808 Win=65535 Len=0"
"168","119.755580785","10.0.2.15","157.240.0.60","TLSv1.2","157","Application Data"
"169","119.756128015","157.240.0.60","10.0.2.15","TCP","60","443  >  34064 [ACK] Seq=9451 Ack=1911 Win=65535 Len=0"
"170","119.925923628","157.240.0.60","10.0.2.15","TLSv1.2","144","Application Data"
"171","119.925992367","10.0.2.15","157.240.0.60","TCP","54","34064  >  443 [ACK] Seq=1911 Ack=9541 Win=65535 Len=0"
"262","128.694724763","157.240.0.60","10.0.2.15","TLSv1.2","131","Application Data"
"263","128.694787280","10.0.2.15","157.240.0.60","TCP","54","34064  >  443 [ACK] Seq=1911 Ack=9618 Win=65535 Len=0"
"266","132.122550284","157.240.0.60","10.0.2.15","TLSv1.2","131","Application Data"
"267","132.122592103","10.0.2.15","157.240.0.60","TCP","54","34064  >  443 [ACK] Seq=1911 Ack=9695 Win=65535 Len=0"
"268","134.420828469","157.240.0.60","10.0.2.15","TLSv1.2","301","Application Data"
"269","134.420878553","10.0.2.15","157.240.0.60","TCP","54","34064  >  443 [ACK] Seq=1911 Ack=9942 Win=65535 Len=0"
"270","134.633054783","10.0.2.15","157.240.0.60","TLSv1.2","145","Application Data"
"271","134.633551227","157.240.0.60","10.0.2.15","TCP","60","443  >  34064 [ACK] Seq=9942 Ack=2002 Win=65535 Len=0"
"272","134.733371897","10.0.2.15","157.240.0.60","TLSv1.2","157","Application Data"
"273","134.733947860","157.240.0.60","10.0.2.15","TCP","60","443  >  34064 [ACK] Seq=9942 Ack=2105 Win=65535 Len=0"
"274","134.903524172","157.240.0.60","10.0.2.15","TLSv1.2","144","Application Data"
"275","134.903567523","10.0.2.15","157.240.0.60","TCP","54","34064  >  443 [ACK] Seq=2105 Ack=10032 Win=65535 Len=0"
"276","148.121632743","157.240.0.60","10.0.2.15","TLSv1.2","131","Application Data"
"277","148.121697355","10.0.2.15","157.240.0.60","TCP","54","34064  >  443 [ACK] Seq=2105 Ack=10109 Win=65535 Len=0"
"278","149.459069397","157.240.0.60","10.0.2.15","TLSv1.2","784","Application Data"
"279","149.459126524","10.0.2.15","157.240.0.60","TCP","54","34064  >  443 [ACK] Seq=2105 Ack=10839 Win=65535 Len=0"
"280","149.670163346","10.0.2.15","157.240.0.60","TLSv1.2","145","Application Data"
"281","149.671340259","157.240.0.60","10.0.2.15","TCP","60","443  >  34064 [ACK] Seq=10839 Ack=2196 Win=65535 Len=0"
"282","149.759116356","10.0.2.15","157.240.0.60","TLSv1.2","157","Application Data"
"283","149.759791255","157.240.0.60","10.0.2.15","TCP","60","443  >  34064 [ACK] Seq=10839 Ack=2299 Win=65535 Len=0"
"284","149.931762594","157.240.0.60","10.0.2.15","TLSv1.2","144","Application Data"
"285","149.931851592","10.0.2.15","157.240.0.60","TCP","54","34064  >  443 [ACK] Seq=2299 Ack=10929 Win=65535 Len=0"
"286","152.360515998","157.240.0.60","10.0.2.15","TLSv1.2","131","Application Data"
"287","152.360579277","10.0.2.15","157.240.0.60","TCP","54","34064  >  443 [ACK] Seq=2299 Ack=11006 Win=65535 Len=0"
"288","155.359206869","157.240.0.60","10.0.2.15","TLSv1.2","131","Application Data"
"289","155.359242516","10.0.2.15","157.240.0.60","TCP","54","34064  >  443 [ACK] Seq=2299 Ack=11083 Win=65535 Len=0"
"290","156.733112895","157.240.0.60","10.0.2.15","TLSv1.2","131","Application Data"
"291","156.733309936","10.0.2.15","157.240.0.60","TCP","54","34064  >  443 [ACK] Seq=2299 Ack=11160 Win=65535 Len=0"
"292","161.959373340","157.240.0.60","10.0.2.15","TLSv1.2","131","Application Data"
"293","161.959413275","10.0.2.15","157.240.0.60","TCP","54","34064  >  443 [ACK] Seq=2299 Ack=11237 Win=65535 Len=0"
"309","164.196642313","157.240.0.60","10.0.2.15","TLSv1.2","317","Application Data"
"310","164.196705812","10.0.2.15","157.240.0.60","TCP","54","34064  >  443 [ACK] Seq=2299 Ack=11500 Win=65535 Len=0"
"311","164.401371727","10.0.2.15","157.240.0.60","TLSv1.2","145","Application Data"
"312","164.401840980","157.240.0.60","10.0.2.15","TCP","60","443  >  34064 [ACK] Seq=11500 Ack=2390 Win=65535 Len=0"
"313","164.583181380","10.0.2.15","157.240.0.60","TLSv1.2","157","Application Data"
"314","164.583455235","157.240.0.60","10.0.2.15","TCP","60","443  >  34064 [ACK] Seq=11500 Ack=2493 Win=65535 Len=0"
"315","164.764070973","157.240.0.60","10.0.2.15","TLSv1.2","144","Application Data"
"316","164.764099227","10.0.2.15","157.240.0.60","TCP","54","34064  >  443 [ACK] Seq=2493 Ack=11590 Win=65535 Len=0"
"317","167.736296494","157.240.0.60","10.0.2.15","TLSv1.2","131","Application Data"
"318","167.736360825","10.0.2.15","157.240.0.60","TCP","54","34064  >  443 [ACK] Seq=2493 Ack=11667 Win=65535 Len=0"
"319","171.198740668","10.0.2.15","157.240.0.60","TLSv1.2","118","Application Data"
"320","171.199368142","157.240.0.60","10.0.2.15","TCP","60","443  >  34064 [ACK] Seq=11667 Ack=2557 Win=65535 Len=0"
"323","177.238824950","157.240.0.60","10.0.2.15","TLSv1.2","381","Application Data"
"324","177.239017382","10.0.2.15","157.240.0.60","TCP","54","34064  >  443 [ACK] Seq=2557 Ack=11994 Win=65535 Len=0"
"325","177.433810115","10.0.2.15","157.240.0.60","TLSv1.2","145","Application Data"
"326","177.434101092","157.240.0.60","10.0.2.15","TCP","60","443  >  34064 [ACK] Seq=11994 Ack=2648 Win=65535 Len=0"
"327","177.601548916","157.240.0.60","10.0.2.15","TLSv1.2","142","Application Data"
"328","177.601586497","10.0.2.15","157.240.0.60","TCP","54","34064  >  443 [ACK] Seq=2648 Ack=12082 Win=65535 Len=0"
"329","177.606023825","10.0.2.15","157.240.0.60","TLSv1.2","126","Application Data"
"330","177.606807334","157.240.0.60","10.0.2.15","TCP","60","443  >  34064 [ACK] Seq=12082 Ack=2720 Win=65535 Len=0"
"331","179.078444372","10.0.2.15","157.240.0.60","TLSv1.2","118","Application Data"
"332","179.078979017","157.240.0.60","10.0.2.15","TCP","60","443  >  34064 [ACK] Seq=12082 Ack=2784 Win=65535 Len=0"
"333","179.086281799","10.0.2.15","157.240.0.60","TLSv1.2","157","Application Data"
"334","179.086852462","157.240.0.60","10.0.2.15","TCP","60","443  >  34064 [ACK] Seq=12082 Ack=2887 Win=65535 Len=0"
"335","179.249998869","157.240.0.60","10.0.2.15","TLSv1.2","112","Application Data"
"336","179.259424207","157.240.0.60","10.0.2.15","TLSv1.2","144","Application Data"
"337","179.259629714","10.0.2.15","157.240.0.60","TCP","54","34064  >  443 [ACK] Seq=2887 Ack=12230 Win=65535 Len=0"
