"No.","Time","Source","Destination","Protocol","Length","Info"
"1","0.000000000","10.0.2.15","157.240.221.60","TLSv1.2","118","Application Data"
"2","0.000570968","157.240.221.60","10.0.2.15","TCP","60","443  >  36966 [ACK] Seq=1 Ack=65 Win=65535 Len=0"
"12","0.388692601","10.0.2.15","157.240.221.60","TLSv1.2","124","Application Data"
"13","0.390062121","157.240.221.60","10.0.2.15","TCP","60","443  >  36966 [ACK] Seq=1 Ack=135 Win=65535 Len=0"
"15","0.657334605","157.240.221.60","10.0.2.15","TLSv1.2","126","Application Data"
"16","0.657453662","10.0.2.15","157.240.221.60","TCP","54","36966  >  443 [ACK] Seq=135 Ack=73 Win=63356 Len=0"
"76","2.004750603","157.240.221.60","10.0.2.15","TLSv1.2","381","Application Data"
"77","2.004833421","10.0.2.15","157.240.221.60","TCP","54","36966  >  443 [ACK] Seq=135 Ack=400 Win=63356 Len=0"
"78","2.552534861","10.0.2.15","157.240.221.60","TLSv1.2","145","Application Data"
"79","2.553460064","157.240.221.60","10.0.2.15","TCP","60","443  >  36966 [ACK] Seq=400 Ack=226 Win=65535 Len=0"
"101","6.148224642","10.0.2.15","157.240.221.60","TLSv1.2","181","Application Data"
"102","6.148874241","157.240.221.60","10.0.2.15","TCP","60","443  >  36966 [ACK] Seq=400 Ack=353 Win=65535 Len=0"
"103","6.357674646","157.240.221.60","10.0.2.15","TLSv1.2","144","Application Data"
"104","6.357830483","10.0.2.15","157.240.221.60","TCP","54","36966  >  443 [ACK] Seq=353 Ack=490 Win=63356 Len=0"
"109","12.384987852","157.240.221.60","10.0.2.15","TLSv1.2","131","Application Data"
"110","12.385035663","10.0.2.15","157.240.221.60","TCP","54","36966  >  443 [ACK] Seq=353 Ack=567 Win=63356 Len=0"
"111","15.797357627","157.240.221.60","10.0.2.15","TLSv1.2","131","Application Data"
"112","15.797401591","10.0.2.15","157.240.221.60","TCP","54","36966  >  443 [ACK] Seq=353 Ack=644 Win=63356 Len=0"
"140","19.275370431","157.240.221.60","10.0.2.15","TLSv1.2","349","Application Data"
"141","19.275418252","10.0.2.15","157.240.221.60","TCP","54","36966  >  443 [ACK] Seq=353 Ack=939 Win=63356 Len=0"
"142","19.540645619","10.0.2.15","157.240.221.60","TLSv1.2","145","Application Data"
"143","19.541121717","157.240.221.60","10.0.2.15","TCP","60","443  >  36966 [ACK] Seq=939 Ack=444 Win=65535 Len=0"
"144","19.661854930","10.0.2.15","157.240.221.60","TLSv1.2","157","Application Data"
"145","19.662557349","157.240.221.60","10.0.2.15","TCP","60","443  >  36966 [ACK] Seq=939 Ack=547 Win=65535 Len=0"
"146","20.025920637","157.240.221.60","10.0.2.15","TLSv1.2","144","Application Data"
"147","20.026075792","10.0.2.15","157.240.221.60","TCP","54","36966  >  443 [ACK] Seq=547 Ack=1029 Win=63356 Len=0"
"177","26.061531191","157.240.221.60","10.0.2.15","TLSv1.2","131","Application Data"
"178","26.061583611","10.0.2.15","157.240.221.60","TCP","54","36966  >  443 [ACK] Seq=547 Ack=1106 Win=63356 Len=0"
"179","29.929661217","157.240.221.60","10.0.2.15","TLSv1.2","131","Application Data"
"180","29.929708928","10.0.2.15","157.240.221.60","TCP","54","36966  >  443 [ACK] Seq=547 Ack=1183 Win=63356 Len=0"
"181","30.458462431","157.240.221.60","10.0.2.15","TLSv1.2","131","Application Data"
"182","30.458577440","10.0.2.15","157.240.221.60","TCP","54","36966  >  443 [ACK] Seq=547 Ack=1260 Win=63356 Len=0"
"197","34.125541965","157.240.221.60","10.0.2.15","TLSv1.2","131","Application Data"
"198","34.125583414","10.0.2.15","157.240.221.60","TCP","54","36966  >  443 [ACK] Seq=547 Ack=1337 Win=63356 Len=0"
"199","36.661870323","157.240.221.60","10.0.2.15","TLSv1.2","736","Application Data"
"200","36.661918275","10.0.2.15","157.240.221.60","TCP","54","36966  >  443 [ACK] Seq=547 Ack=2019 Win=63356 Len=0"
"201","36.936109093","10.0.2.15","157.240.221.60","TLSv1.2","145","Application Data"
"202","36.937037424","157.240.221.60","10.0.2.15","TCP","60","443  >  36966 [ACK] Seq=2019 Ack=638 Win=65535 Len=0"
"203","37.065440573","10.0.2.15","157.240.221.60","TLSv1.2","157","Application Data"
"204","37.066213396","157.240.221.60","10.0.2.15","TCP","60","443  >  36966 [ACK] Seq=2019 Ack=741 Win=65535 Len=0"
"205","37.251825986","157.240.221.60","10.0.2.15","TLSv1.2","144","Application Data"
"206","37.251869740","10.0.2.15","157.240.221.60","TCP","54","36966  >  443 [ACK] Seq=741 Ack=2109 Win=63356 Len=0"
"209","39.224786676","157.240.221.60","10.0.2.15","TLSv1.2","131","Application Data"
"210","39.224845037","10.0.2.15","157.240.221.60","TCP","54","36966  >  443 [ACK] Seq=741 Ack=2186 Win=63356 Len=0"
"211","45.696445093","157.240.221.60","10.0.2.15","TLSv1.2","131","Application Data"
"212","45.696488676","10.0.2.15","157.240.221.60","TCP","54","36966  >  443 [ACK] Seq=741 Ack=2263 Win=63356 Len=0"
"219","52.798245153","157.240.221.60","10.0.2.15","TLSv1.2","150","Application Data"
"220","52.798295750","10.0.2.15","157.240.221.60","TCP","54","36966  >  443 [ACK] Seq=741 Ack=2359 Win=63356 Len=0"
"221","52.839918705","10.0.2.15","157.240.221.60","TLSv1.2","128","Application Data"
"222","52.840486738","157.240.221.60","10.0.2.15","TCP","60","443  >  36966 [ACK] Seq=2359 Ack=815 Win=65535 Len=0"
"252","54.604590482","10.0.2.15","157.240.221.60","TLSv1.2","124","Application Data"
"253","54.605065548","157.240.221.60","10.0.2.15","TCP","60","443  >  36966 [ACK] Seq=2359 Ack=885 Win=65535 Len=0"
"254","54.777036715","157.240.221.60","10.0.2.15","TLSv1.2","126","Application Data"
"255","54.826041772","10.0.2.15","157.240.221.60","TCP","54","36966  >  443 [ACK] Seq=885 Ack=2431 Win=63356 Len=0"
"256","57.494177328","10.0.2.15","157.240.221.60","TLSv1.2","118","Application Data"
"257","57.494969268","157.240.221.60","10.0.2.15","TCP","60","443  >  36966 [ACK] Seq=2431 Ack=949 Win=65535 Len=0"
"265","66.705434030","157.240.221.60","10.0.2.15","TLSv1.2","1088","Application Data"
"266","66.705516838","10.0.2.15","157.240.221.60","TCP","54","36966  >  443 [ACK] Seq=949 Ack=3465 Win=63356 Len=0"
"267","66.932699347","10.0.2.15","157.240.221.60","TLSv1.2","145","Application Data"
"268","66.933592992","157.240.221.60","10.0.2.15","TCP","60","443  >  36966 [ACK] Seq=3465 Ack=1040 Win=65535 Len=0"
"269","73.250284375","10.0.2.15","157.240.221.60","TLSv1.2","124","Application Data"
"270","73.250746757","157.240.221.60","10.0.2.15","TCP","60","443  >  36966 [ACK] Seq=3465 Ack=1110 Win=65535 Len=0"
"271","73.602823390","157.240.221.60","10.0.2.15","TLSv1.2","126","Application Data"
"272","73.602891490","10.0.2.15","157.240.221.60","TCP","54","36966  >  443 [ACK] Seq=1110 Ack=3537 Win=63356 Len=0"
"273","80.167460608","157.240.221.60","10.0.2.15","TLSv1.2","365","Application Data"
"274","80.167506876","10.0.2.15","157.240.221.60","TCP","54","36966  >  443 [ACK] Seq=1110 Ack=3848 Win=63356 Len=0"
"275","80.480034431","10.0.2.15","157.240.221.60","TLSv1.2","145","Application Data"
"276","80.480699981","157.240.221.60","10.0.2.15","TCP","60","443  >  36966 [ACK] Seq=3848 Ack=1201 Win=65535 Len=0"
"279","91.545783232","10.0.2.15","157.240.221.60","TLSv1.2","118","Application Data"
"280","91.546662470","157.240.221.60","10.0.2.15","TCP","60","443  >  36966 [ACK] Seq=3848 Ack=1265 Win=65535 Len=0"
"281","94.067853803","10.0.2.15","157.240.221.60","TLSv1.2","181","Application Data"
"282","94.068957559","157.240.221.60","10.0.2.15","TCP","60","443  >  36966 [ACK] Seq=3848 Ack=1392 Win=65535 Len=0"
"283","94.242051289","157.240.221.60","10.0.2.15","TLSv1.2","144","Application Data"
"284","94.242159255","10.0.2.15","157.240.221.60","TCP","54","36966  >  443 [ACK] Seq=1392 Ack=3938 Win=63356 Len=0"
"287","97.020215454","157.240.221.60","10.0.2.15","TLSv1.2","365","Application Data"
"288","97.020283734","10.0.2.15","157.240.221.60","TCP","54","36966  >  443 [ACK] Seq=1392 Ack=4249 Win=63356 Len=0"
"289","97.317101728","10.0.2.15","157.240.221.60","TLSv1.2","145","Application Data"
"290","97.318287351","157.240.221.60","10.0.2.15","TCP","60","443  >  36966 [ACK] Seq=4249 Ack=1483 Win=65535 Len=0"
"291","97.503131261","10.0.2.15","157.240.221.60","TLSv1.2","157","Application Data"
"292","97.503582823","157.240.221.60","10.0.2.15","TCP","60","443  >  36966 [ACK] Seq=4249 Ack=1586 Win=65535 Len=0"
"293","97.700007262","157.240.221.60","10.0.2.15","TLSv1.2","144","Application Data"
"294","97.700052919","10.0.2.15","157.240.221.60","TCP","54","36966  >  443 [ACK] Seq=1586 Ack=4339 Win=63356 Len=0"
"297","105.912153370","157.240.221.60","10.0.2.15","TLSv1.2","131","Application Data"
"298","105.912220939","10.0.2.15","157.240.221.60","TCP","54","36966  >  443 [ACK] Seq=1586 Ack=4416 Win=63356 Len=0"
"299","108.868753705","157.240.221.60","10.0.2.15","TLSv1.2","430","Application Data"
"300","108.868812657","10.0.2.15","157.240.221.60","TCP","54","36966  >  443 [ACK] Seq=1586 Ack=4792 Win=63356 Len=0"
"301","109.249139942","10.0.2.15","157.240.221.60","TLSv1.2","145","Application Data"
"302","109.250084935","157.240.221.60","10.0.2.15","TCP","60","443  >  36966 [ACK] Seq=4792 Ack=1677 Win=65535 Len=0"
"303","109.444811119","10.0.2.15","157.240.221.60","TLSv1.2","157","Application Data"
"304","109.445546543","157.240.221.60","10.0.2.15","TCP","60","443  >  36966 [ACK] Seq=4792 Ack=1780 Win=65535 Len=0"
"305","109.811283116","157.240.221.60","10.0.2.15","TLSv1.2","144","Application Data"
"306","109.811380793","10.0.2.15","157.240.221.60","TCP","54","36966  >  443 [ACK] Seq=1780 Ack=4882 Win=63356 Len=0"
"307","119.423232323","157.240.221.60","10.0.2.15","TLSv1.2","131","Application Data"
"308","119.423276427","10.0.2.15","157.240.221.60","TCP","54","36966  >  443 [ACK] Seq=1780 Ack=4959 Win=63356 Len=0"
"309","121.282861891","157.240.221.60","10.0.2.15","TLSv1.2","430","Application Data"
"310","121.282971050","10.0.2.15","157.240.221.60","TCP","54","36966  >  443 [ACK] Seq=1780 Ack=5335 Win=63356 Len=0"
"311","121.593948021","10.0.2.15","157.240.221.60","TLSv1.2","145","Application Data"
"312","121.595900017","157.240.221.60","10.0.2.15","TCP","60","443  >  36966 [ACK] Seq=5335 Ack=1871 Win=65535 Len=0"
"313","121.765965682","10.0.2.15","157.240.221.60","TLSv1.2","157","Application Data"
"314","121.766937166","157.240.221.60","10.0.2.15","TCP","60","443  >  36966 [ACK] Seq=5335 Ack=1974 Win=65535 Len=0"
"315","122.024805676","157.240.221.60","10.0.2.15","TLSv1.2","144","Application Data"
"316","122.024901579","10.0.2.15","157.240.221.60","TCP","54","36966  >  443 [ACK] Seq=1974 Ack=5425 Win=63356 Len=0"
"323","132.132632491","157.240.221.60","10.0.2.15","TLSv1.2","131","Application Data"
"324","132.132697204","10.0.2.15","157.240.221.60","TCP","54","36966  >  443 [ACK] Seq=1974 Ack=5502 Win=63356 Len=0"
"325","134.901947468","157.240.221.60","10.0.2.15","TLSv1.2","150","Application Data"
"326","134.902004396","10.0.2.15","157.240.221.60","TCP","54","36966  >  443 [ACK] Seq=1974 Ack=5598 Win=63356 Len=0"
"327","134.948227141","10.0.2.15","157.240.221.60","TLSv1.2","128","Application Data"
"328","134.948900807","157.240.221.60","10.0.2.15","TCP","60","443  >  36966 [ACK] Seq=5598 Ack=2048 Win=65535 Len=0"
"329","135.055386817","157.240.221.60","10.0.2.15","TLSv1.2","446","Application Data"
"330","135.055435400","10.0.2.15","157.240.221.60","TCP","54","36966  >  443 [ACK] Seq=2048 Ack=5990 Win=63356 Len=0"
"331","135.341389826","10.0.2.15","157.240.221.60","TLSv1.2","145","Application Data"
"332","135.342322747","157.240.221.60","10.0.2.15","TCP","60","443  >  36966 [ACK] Seq=5990 Ack=2139 Win=65535 Len=0"
"333","135.737353999","10.0.2.15","157.240.221.60","TLSv1.2","157","Application Data"
"334","135.738444040","157.240.221.60","10.0.2.15","TCP","60","443  >  36966 [ACK] Seq=5990 Ack=2242 Win=65535 Len=0"
"335","136.069367353","157.240.221.60","10.0.2.15","TLSv1.2","144","Application Data"
"336","136.069481200","10.0.2.15","157.240.221.60","TCP","54","36966  >  443 [ACK] Seq=2242 Ack=6080 Win=63356 Len=0"
