"No.","Time","Source","Destination","Protocol","Length","Info"
"1","0.000000000","157.240.0.60","10.0.2.15","TLSv1.2","131","Application Data"
"4","2.606144836","157.240.0.60","10.0.2.15","TCP","60","443  >  33122 [ACK] Seq=78 Ack=65 Win=65535 Len=0"
"5","2.728946432","157.240.0.60","10.0.2.15","TLSv1.2","131","Application Data"
"7","11.091310340","157.240.0.60","10.0.2.15","TCP","1446","443  >  33122 [PSH, ACK] Seq=155 Ack=65 Win=65535 Len=1392 [TCP segment of a reassembled PDU]"
"9","11.091906291","157.240.0.60","10.0.2.15","TLSv1.2","886","Application Data, Application Data"
"12","11.193252713","157.240.0.60","10.0.2.15","TCP","60","443  >  33122 [ACK] Seq=2379 Ack=156 Win=65535 Len=0"
"18","15.556075650","157.240.0.60","10.0.2.15","TCP","60","443  >  33122 [ACK] Seq=2379 Ack=226 Win=65535 Len=0"
"19","15.724072697","157.240.0.60","10.0.2.15","TLSv1.2","126","Application Data"
"23","26.108277179","157.240.0.60","10.0.2.15","TCP","1514","443  >  33122 [ACK] Seq=2451 Ack=226 Win=65535 Len=1460 [TCP segment of a reassembled PDU]"
"25","26.108560462","157.240.0.60","10.0.2.15","TLSv1.2","107","Application Data"
"27","26.110364416","157.240.0.60","10.0.2.15","TCP","1446","443  >  33122 [PSH, ACK] Seq=3964 Ack=226 Win=65535 Len=1392 [TCP segment of a reassembled PDU]"
"29","26.110938401","157.240.0.60","10.0.2.15","TLSv1.2","1257","Application Data"
"31","26.114889750","157.240.0.60","10.0.2.15","TCP","1446","443  >  33122 [PSH, ACK] Seq=6559 Ack=226 Win=65535 Len=1392 [TCP segment of a reassembled PDU]"
"34","26.127240178","157.240.0.60","10.0.2.15","TLSv1.2","758","Application Data, Application Data"
"37","26.311986989","157.240.0.60","10.0.2.15","TCP","60","443  >  33122 [ACK] Seq=8655 Ack=317 Win=65535 Len=0"
"46","40.068134994","157.240.0.60","10.0.2.15","TCP","60","443  >  33122 [ACK] Seq=8655 Ack=387 Win=65535 Len=0"
"47","40.231508369","157.240.0.60","10.0.2.15","TLSv1.2","126","Application Data"
"49","41.290373431","157.240.0.60","10.0.2.15","TLSv1.2","1567","Application Data"
"51","41.292644274","157.240.0.60","10.0.2.15","TCP","1446","443  >  33122 [PSH, ACK] Seq=10240 Ack=387 Win=65535 Len=1392 [TCP segment of a reassembled PDU]"
"53","41.293096334","157.240.0.60","10.0.2.15","TLSv1.2","1379","Application Data, Application Data"
"56","41.505299464","157.240.0.60","10.0.2.15","TCP","60","443  >  33122 [ACK] Seq=12957 Ack=478 Win=65535 Len=0"
"57","56.045642607","157.240.0.60","10.0.2.15","TCP","1514","443  >  33122 [ACK] Seq=12957 Ack=478 Win=65535 Len=1460 [TCP segment of a reassembled PDU]"
"59","56.045883941","157.240.0.60","10.0.2.15","TLSv1.2","107","Application Data"
"61","56.047512184","157.240.0.60","10.0.2.15","TCP","1446","443  >  33122 [PSH, ACK] Seq=14470 Ack=478 Win=65535 Len=1392 [TCP segment of a reassembled PDU]"
"63","56.047862153","157.240.0.60","10.0.2.15","TLSv1.2","1257","Application Data"
"65","56.057252477","157.240.0.60","10.0.2.15","TLSv1.2","2150","Application Data, Application Data"
"68","56.250311177","157.240.0.60","10.0.2.15","TCP","60","443  >  33122 [ACK] Seq=19161 Ack=569 Win=65535 Len=0"
"74","60.195664696","157.240.0.60","10.0.2.15","TCP","60","443  >  33122 [ACK] Seq=19161 Ack=639 Win=65535 Len=0"
"75","60.356529518","157.240.0.60","10.0.2.15","TLSv1.2","126","Application Data"
"79","71.182708086","157.240.0.60","10.0.2.15","TCP","1446","443  >  33122 [PSH, ACK] Seq=19233 Ack=639 Win=65535 Len=1392 [TCP segment of a reassembled PDU]"
"81","71.190244351","157.240.0.60","10.0.2.15","TLSv1.2","2770","Application Data, Application Data"
"83","71.190519890","157.240.0.60","10.0.2.15","TLSv1.2","2166","Application Data, Application Data"
"86","71.335370669","157.240.0.60","10.0.2.15","TCP","60","443  >  33122 [ACK] Seq=25453 Ack=730 Win=65535 Len=0"
"97","79.562725415","157.240.0.60","10.0.2.15","TCP","60","443  >  33122 [ACK] Seq=25453 Ack=800 Win=65535 Len=0"
"98","79.749477291","157.240.0.60","10.0.2.15","TLSv1.2","126","Application Data"
"100","86.095732257","157.240.0.60","10.0.2.15","TCP","1514","443  >  33122 [ACK] Seq=25525 Ack=800 Win=65535 Len=1460 [TCP segment of a reassembled PDU]"
"102","86.095953934","157.240.0.60","10.0.2.15","TLSv1.2","107","Application Data"
"104","86.097293033","157.240.0.60","10.0.2.15","TLSv1.2","2649","Application Data"
"106","86.101388716","157.240.0.60","10.0.2.15","TLSv1.2","2150","Application Data, Application Data"
"109","86.259722492","157.240.0.60","10.0.2.15","TCP","60","443  >  33122 [ACK] Seq=31729 Ack=891 Win=65535 Len=0"
"111","88.007544218","157.240.0.60","10.0.2.15","TCP","60","443  >  33122 [ACK] Seq=31729 Ack=955 Win=65535 Len=0"
"112","88.169548964","157.240.0.60","10.0.2.15","TLSv1.2","112","Application Data"
"115","90.819100827","157.240.0.60","10.0.2.15","TCP","60","443  >  33122 [ACK] Seq=31787 Ack=1152 Win=65535 Len=0"
"116","90.986270211","157.240.0.60","10.0.2.15","TLSv1.2","144","Application Data"
"118","95.265443659","157.240.0.60","10.0.2.15","TLSv1.2","131","Application Data"
"120","99.274675819","157.240.0.60","10.0.2.15","TLSv1.2","131","Application Data"
"122","101.265045438","157.240.0.60","10.0.2.15","TCP","1514","443  >  33122 [ACK] Seq=32031 Ack=1152 Win=65535 Len=1460 [TCP segment of a reassembled PDU]"
"124","101.265384857","157.240.0.60","10.0.2.15","TLSv1.2","107","Application Data"
"126","101.266974055","157.240.0.60","10.0.2.15","TCP","1446","443  >  33122 [PSH, ACK] Seq=33544 Ack=1152 Win=65535 Len=1392 [TCP segment of a reassembled PDU]"
"128","101.267275442","157.240.0.60","10.0.2.15","TLSv1.2","1257","Application Data"
"130","101.271187489","157.240.0.60","10.0.2.15","TCP","1446","443  >  33122 [PSH, ACK] Seq=36139 Ack=1152 Win=65535 Len=1392 [TCP segment of a reassembled PDU]"
"132","101.271538960","157.240.0.60","10.0.2.15","TLSv1.2","1446","Application Data"
"134","101.276005149","157.240.0.60","10.0.2.15","TLSv1.2","390","Application Data"
"136","101.276965234","157.240.0.60","10.0.2.15","TLSv1.2","1567","Application Data"
"138","101.279855610","157.240.0.60","10.0.2.15","TCP","1446","443  >  33122 [PSH, ACK] Seq=40772 Ack=1152 Win=65535 Len=1392 [TCP segment of a reassembled PDU]"
"140","101.282344430","157.240.0.60","10.0.2.15","TLSv1.2","1446","Application Data"
"142","101.284624218","157.240.0.60","10.0.2.15","TLSv1.2","719","Application Data"
"145","101.390379505","157.240.0.60","10.0.2.15","TCP","60","443  >  33122 [ACK] Seq=44221 Ack=1243 Win=65535 Len=0"
"147","101.443825948","157.240.0.60","10.0.2.15","TCP","60","443  >  33122 [ACK] Seq=44221 Ack=1346 Win=65535 Len=0"
"148","101.923850668","157.240.0.60","10.0.2.15","TLSv1.2","144","Application Data"
"152","106.768577438","157.240.0.60","10.0.2.15","TLSv1.2","131","Application Data"
"154","109.131233091","157.240.0.60","10.0.2.15","TLSv1.2","142","Application Data"
"157","109.134505029","157.240.0.60","10.0.2.15","TCP","60","443  >  33122 [ACK] Seq=44476 Ack=1418 Win=65535 Len=0"
"158","109.868849590","157.240.0.60","10.0.2.15","TLSv1.2","131","Application Data"
"163","111.401612941","157.240.0.60","10.0.2.15","TCP","60","443  >  33122 [ACK] Seq=44553 Ack=2371 Win=65535 Len=0"
"169","111.563565960","157.240.0.60","10.0.2.15","TLSv1.2","118","Application Data"
"171","111.604015196","157.240.0.60","10.0.2.15","TCP","60","443  >  50174 [SYN, ACK] Seq=0 Ack=1 Win=65535 Len=0 MSS=1460"
"174","111.605118060","157.240.0.60","10.0.2.15","TCP","60","443  >  50174 [ACK] Seq=1 Ack=518 Win=65535 Len=0"
"175","111.672696663","157.240.0.60","10.0.2.15","TLSv1.3","266","Server Hello, Change Cipher Spec, Application Data"
"178","111.673598419","157.240.0.60","10.0.2.15","TCP","60","443  >  50174 [ACK] Seq=213 Ack=582 Win=65535 Len=0"
"180","111.673846315","157.240.0.60","10.0.2.15","TCP","60","443  >  50174 [ACK] Seq=213 Ack=680 Win=65535 Len=0"
"185","111.674831037","157.240.0.60","10.0.2.15","TCP","60","443  >  50174 [ACK] Seq=213 Ack=1143 Win=65535 Len=0"
"186","111.674831528","157.240.0.60","10.0.2.15","TCP","60","443  >  50174 [ACK] Seq=213 Ack=1946 Win=65535 Len=0"
"187","111.674939571","157.240.0.60","10.0.2.15","TCP","60","443  >  50174 [ACK] Seq=213 Ack=2069 Win=65535 Len=0"
"188","111.674939621","157.240.0.60","10.0.2.15","TCP","60","443  >  50174 [ACK] Seq=213 Ack=2872 Win=65535 Len=0"
"189","111.745495973","157.240.0.60","10.0.2.15","TLSv1.3","225","Application Data"
"190","111.745643551","157.240.0.60","10.0.2.15","TLSv1.3","128","Application Data"
"193","111.746095030","157.240.0.60","10.0.2.15","TCP","60","443  >  50174 [ACK] Seq=458 Ack=2903 Win=65535 Len=0"
"194","111.746259539","157.240.0.60","10.0.2.15","TLSv1.3","98","Application Data"
"195","111.748852175","157.240.0.60","10.0.2.15","TLSv1.3","89","Application Data"
"197","111.768504782","157.240.0.60","10.0.2.15","TLSv1.3","544","Application Data"
"198","111.775536847","157.240.0.60","10.0.2.15","TLSv1.3","266","Application Data"
"202","116.381812984","157.240.0.60","10.0.2.15","TCP","1514","443  >  33122 [ACK] Seq=44617 Ack=2371 Win=65535 Len=1460 [TCP segment of a reassembled PDU]"
"204","116.382068445","157.240.0.60","10.0.2.15","TLSv1.2","107","Application Data"
"206","116.383561462","157.240.0.60","10.0.2.15","TCP","1446","443  >  33122 [PSH, ACK] Seq=46130 Ack=2371 Win=65535 Len=1392 [TCP segment of a reassembled PDU]"
"208","116.383830178","157.240.0.60","10.0.2.15","TLSv1.2","1257","Application Data"
"210","116.388378200","157.240.0.60","10.0.2.15","TCP","1446","443  >  33122 [PSH, ACK] Seq=48725 Ack=2371 Win=65535 Len=1392 [TCP segment of a reassembled PDU]"
"212","116.388634607","157.240.0.60","10.0.2.15","TLSv1.2","774","Application Data, Application Data"
"215","116.574415778","157.240.0.60","10.0.2.15","TCP","60","443  >  33122 [ACK] Seq=50837 Ack=2462 Win=65535 Len=0"
"217","116.626262796","157.240.0.60","10.0.2.15","TCP","60","443  >  33122 [ACK] Seq=50837 Ack=2565 Win=65535 Len=0"
"218","116.789495701","157.240.0.60","10.0.2.15","TLSv1.2","144","Application Data"
"220","118.921517183","157.240.0.60","10.0.2.15","TLSv1.2","131","Application Data"
"226","122.035659901","157.240.0.60","10.0.2.15","TLSv1.2","131","Application Data"
"228","131.615518281","157.240.0.60","10.0.2.15","TCP","1514","443  >  33122 [ACK] Seq=51081 Ack=2565 Win=65535 Len=1460 [TCP segment of a reassembled PDU]"
"230","131.615868815","157.240.0.60","10.0.2.15","TLSv1.2","107","Application Data"
"232","131.617412357","157.240.0.60","10.0.2.15","TCP","1446","443  >  33122 [PSH, ACK] Seq=52594 Ack=2565 Win=65535 Len=1392 [TCP segment of a reassembled PDU]"
"234","131.617661951","157.240.0.60","10.0.2.15","TLSv1.2","1257","Application Data"
"236","131.624455962","157.240.0.60","10.0.2.15","TLSv1.2","2838","Application Data"
"238","131.627530793","157.240.0.60","10.0.2.15","TLSv1.2","1350","Application Data"
"241","131.705145013","157.240.0.60","10.0.2.15","TCP","60","443  >  33122 [ACK] Seq=59269 Ack=2656 Win=65535 Len=0"
"243","132.674058234","157.240.0.60","10.0.2.15","TCP","60","443  >  33122 [ACK] Seq=59269 Ack=2726 Win=65535 Len=0"
"244","132.833293200","157.240.0.60","10.0.2.15","TLSv1.2","126","Application Data"
"247","133.982751268","157.240.0.60","10.0.2.15","TCP","60","443  >  33122 [ACK] Seq=59341 Ack=2829 Win=65535 Len=0"
"248","134.147710917","157.240.0.60","10.0.2.15","TLSv1.2","144","Application Data"
"250","137.928422733","157.240.0.60","10.0.2.15","TLSv1.2","131","Application Data"
"252","141.291824551","157.240.0.60","10.0.2.15","TLSv1.2","131","Application Data"
"255","146.137097041","157.240.0.60","10.0.2.15","TCP","1514","443  >  33122 [ACK] Seq=59585 Ack=2829 Win=65535 Len=1460 [TCP segment of a reassembled PDU]"
"257","146.137321483","157.240.0.60","10.0.2.15","TLSv1.2","107","Application Data"
"259","146.138963721","157.240.0.60","10.0.2.15","TCP","1446","443  >  33122 [PSH, ACK] Seq=61098 Ack=2829 Win=65535 Len=1392 [TCP segment of a reassembled PDU]"
"261","146.139290335","157.240.0.60","10.0.2.15","TLSv1.2","1257","Application Data"
"263","146.143362596","157.240.0.60","10.0.2.15","TLSv1.2","2838","Application Data"
"265","146.148409666","157.240.0.60","10.0.2.15","TLSv1.2","1350","Application Data"
"268","146.286657792","157.240.0.60","10.0.2.15","TCP","60","443  >  33122 [ACK] Seq=67773 Ack=2920 Win=65535 Len=0"
"274","151.278433057","157.240.0.60","10.0.2.15","TLSv1.2","131","Application Data"
"277","152.798597036","157.240.0.60","10.0.2.15","TCP","60","443  >  33122 [ACK] Seq=67850 Ack=2984 Win=65535 Len=0"
"279","156.252379541","157.240.0.60","10.0.2.15","TCP","60","443  >  33122 [ACK] Seq=67850 Ack=3054 Win=65535 Len=0"
"280","156.411718866","157.240.0.60","10.0.2.15","TLSv1.2","126","Application Data"
"285","158.286398699","157.240.0.60","10.0.2.15","TCP","60","[TCP Keep-Alive ACK] 443  >  50174 [ACK] Seq=1239 Ack=2903 Win=65535 Len=0"
"286","161.938328944","157.240.0.60","10.0.2.15","TCP","1514","443  >  33122 [ACK] Seq=67922 Ack=3054 Win=65535 Len=1460 [TCP segment of a reassembled PDU]"
"288","161.938755275","157.240.0.60","10.0.2.15","TLSv1.2","107","Application Data"
"290","161.940280382","157.240.0.60","10.0.2.15","TCP","1446","443  >  33122 [PSH, ACK] Seq=69435 Ack=3054 Win=65535 Len=1392 [TCP segment of a reassembled PDU]"
"292","161.940628306","157.240.0.60","10.0.2.15","TLSv1.2","1257","Application Data"
"294","161.949720830","157.240.0.60","10.0.2.15","TLSv1.2","2838","Application Data"
"296","161.950059196","157.240.0.60","10.0.2.15","TLSv1.2","1350","Application Data"
"299","162.164464502","157.240.0.60","10.0.2.15","TCP","60","443  >  33122 [ACK] Seq=76110 Ack=3145 Win=65535 Len=0"
"304","176.164709501","157.240.0.60","10.0.2.15","TCP","1514","443  >  33122 [ACK] Seq=76110 Ack=3145 Win=65535 Len=1460 [TCP segment of a reassembled PDU]"
"306","176.165073746","157.240.0.60","10.0.2.15","TLSv1.2","107","Application Data"
"308","176.165816182","157.240.0.60","10.0.2.15","TCP","1446","443  >  33122 [PSH, ACK] Seq=77623 Ack=3145 Win=65535 Len=1392 [TCP segment of a reassembled PDU]"
"310","176.167255878","157.240.0.60","10.0.2.15","TLSv1.2","1257","Application Data"
"312","176.170152738","157.240.0.60","10.0.2.15","TCP","1446","443  >  33122 [PSH, ACK] Seq=80218 Ack=3145 Win=65535 Len=1392 [TCP segment of a reassembled PDU]"
"314","176.170425186","157.240.0.60","10.0.2.15","TCP","1446","443  >  33122 [PSH, ACK] Seq=81610 Ack=3145 Win=65535 Len=1392 [TCP segment of a reassembled PDU]"
"316","176.175734256","157.240.0.60","10.0.2.15","TLSv1.2","1356","Application Data"
"318","176.177482102","157.240.0.60","10.0.2.15","TCP","1446","443  >  33122 [PSH, ACK] Seq=84304 Ack=3145 Win=65535 Len=1392 [TCP segment of a reassembled PDU]"
"320","176.177851887","157.240.0.60","10.0.2.15","TLSv1.2","646","Application Data, Application Data"
"323","176.410848738","157.240.0.60","10.0.2.15","TCP","60","443  >  33122 [ACK] Seq=86288 Ack=3236 Win=65535 Len=0"
"324","176.823379563","157.240.0.60","10.0.2.15","TLSv1.3","93","Application Data"
"326","176.823909469","157.240.0.60","10.0.2.15","TCP","60","443  >  50174 [FIN, ACK] Seq=1278 Ack=2903 Win=65535 Len=0"
"328","176.824029204","157.240.0.60","10.0.2.15","TCP","60","[TCP Retransmission] 443  >  50174 [FIN, ACK] Seq=1278 Ack=2904 Win=65535 Len=0"
